{"scenario_id": "0c30d03fc14385c0", "policy_version": "v2", "policy_text": "Starting September 1, 2026, we are moving to a hybrid collaboration model for our San Francisco and New York offices. The default expectation is two days per week in-office (Tuesday and Wednesday), with the third day flexible at the team level.\n\nWhy we're doing this: Customer-facing teams have asked for more in-person time for cross-functional planning, and our engineering retros consistently rate hybrid sprints highest. We piloted this model with the Sales team in Q1 and saw measurable lift in pipeline velocity.\n\nWhat's changing for you:\n- Two anchor days (Tue/Wed) for cross-team collaboration\n- One flexible team-choice day, owned by your manager and team\n- Caregiving, medical, and accessibility exceptions are guaranteed, not discretionary \u2014 apply through People Ops, not your manager\n- Fully-remote roles remain fully-remote; this policy applies to those already assigned to an office\n- Three-month ramp: optional in June\u2013August, expected starting September\n\nWe'll run a pulse survey 30 and 90 days after rollout and adjust based on what we learn. This is a starting point, not a final answer.", "parsed_policy": {"scenario_type": "policy_change", "category": "hybrid_work_mandate", "summary": "San Francisco and New York offices moving to mandatory two-day in-office hybrid model with one flexible team day starting September 2026.", "affected_groups": ["sf_office", "ny_office"], "effective_date_relative": "months", "tone": "conciliatory", "has_business_rationale": true, "has_exceptions": true, "exception_authority": "guaranteed", "dimensions_affected": ["autonomy", "flexibility", "commute", "caregiving", "trust"], "severity": 0.45}, "model_version": "sim-0.3-action-based", "baseline": {"enps": 54, "engagement": 0.721, "trust": 0.601, "intent_to_stay": 0.791}, "predicted": {"enps": 44, "engagement": 0.716, "trust": 0.541, "intent_to_stay": 0.766, "confidence": "medium", "confidence_interval_enps": [40, 48]}, "actions": [{"id": "act_d00_00", "day": 0, "intra_day_order": 0, "agent_id": "emp_002", "action_type": "MESSAGE_MANAGER", "target": {"type": "manager", "value": ""}, "content": "Hey, need to flag something early \u2014 the Sacramento commute is a 4-hour round trip by train. I get the rationale for in-office days, but at this distance I'd need to talk through what's realistic for me before September.", "intensity": 0.72, "is_visible_to": ["emp_004"], "sentiment_impact": {"actor_delta": -0.013, "observer_delta": 0.0}}, {"id": "act_d00_01", "day": 0, "intra_day_order": 1, "agent_id": "emp_024", "action_type": "ADVOCATE", "target": {"type": "channel", "value": "#sales"}, "content": "I think the hybrid setup is going to help us \u2014 pipeline reviews are more effective face-to-face, and having the team together two days will help with rep onboarding and retention. The flexibility on exceptions shows leadership actually thought this through.", "intensity": 0.65, "is_visible_to": ["emp_019", "emp_020", "emp_021", "emp_022", "emp_023", "emp_025", "emp_026", "emp_027", "emp_028", "emp_029", "emp_030"], "sentiment_impact": {"actor_delta": 0.025, "observer_delta": 0.01}}, {"id": "act_d01_00", "day": 1, "intra_day_order": 0, "agent_id": "emp_031", "action_type": "MESSAGE_MANAGER", "target": {"type": "manager", "value": ""}, "content": "We need to talk about how this hybrid policy applies to my role. I was recruited as remote-first from Portland with three kids\u2014relocation isn't possible and weekly flights to SF would be untenable with my caregiving responsibilities.", "intensity": 0.75, "is_visible_to": [], "sentiment_impact": {"actor_delta": -0.013, "observer_delta": 0.0}}, {"id": "act_d01_01", "day": 1, "intra_day_order": 1, "agent_id": "emp_011", "action_type": "MESSAGE_MANAGER", "target": {"type": "manager", "value": ""}, "content": "Quick heads up \u2014 the two-day requirement is going to clash hard with my daycare pickup at 5:30. I can make one day work consistently, but two means I'm either paying $50/day for backup care or missing pickup. Can we talk through what 'guaranteed exceptions' actually looks like fo", "intensity": 0.62, "is_visible_to": ["emp_014"], "sentiment_impact": {"actor_delta": -0.013, "observer_delta": 0.0}}, {"id": "act_d02_00", "day": 2, "intra_day_order": 0, "agent_id": "emp_023", "action_type": "MESSAGE_MANAGER", "target": {"type": "manager", "value": ""}, "content": "Need to flag something before September \u2014 the two-day mandate doesn't align with my custody schedule or my client coverage model. My accounts are in Stamford and I've got alternating weeks with the kids; can we talk through how the exception process actually works?", "intensity": 0.62, "is_visible_to": ["emp_024"], "sentiment_impact": {"actor_delta": -0.013, "observer_delta": 0.0}}, {"id": "act_d02_01", "day": 2, "intra_day_order": 1, "agent_id": "emp_009", "action_type": "REQUEST_EXCEPTION", "target": {"type": "manager", "value": ""}, "content": "I relocated to Boulder three years ago under the remote-first policy and my partner just started a tenure-track position at CU\u2014moving isn't an option for us. I need to understand how the guaranteed exceptions process works and confirm I'll qualify given my family situation.", "intensity": 0.75, "is_visible_to": [], "sentiment_impact": {"actor_delta": -0.008, "observer_delta": 0.0}}, {"id": "act_d02_02", "day": 2, "intra_day_order": 2, "agent_id": "emp_001", "action_type": "MESSAGE_MANAGER", "target": {"type": "manager", "value": ""}, "content": "Hey, need to flag something before September. With my spouse on night shifts and the kids' schedule, I can't reliably do two fixed days plus a team day\u2014my commute from Walnut Creek is 75 minutes each way and childcare pickup is non-negotiable at 5:30. Can we talk through what the", "intensity": 0.72, "is_visible_to": ["emp_004"], "sentiment_impact": {"actor_delta": -0.013, "observer_delta": 0.0}}, {"id": "act_d03_00", "day": 3, "intra_day_order": 0, "agent_id": "emp_020", "action_type": "REQUEST_EXCEPTION", "target": {"type": "manager", "value": ""}, "content": "Quick heads up \u2014 I'm 100% supportive of collaboration days, but the 3pm pickup window is non-negotiable for me with two elementary kids. Can we lock in Mon/Fri as my in-office days so I'm not scrambling mid-week?", "intensity": 0.55, "is_visible_to": [], "sentiment_impact": {"actor_delta": -0.008, "observer_delta": 0.0}}, {"id": "act_d03_01", "day": 3, "intra_day_order": 1, "agent_id": "emp_046", "action_type": "MESSAGE_MANAGER", "target": {"type": "manager", "value": ""}, "content": "I need clarity on how the remote exception process works \u2014 I relocated to Raleigh two years ago for my partner's tenure-track job and was hired explicitly as permanent remote. Moving back to SF isn't an option for us.", "intensity": 0.72, "is_visible_to": ["emp_004"], "sentiment_impact": {"actor_delta": -0.013, "observer_delta": 0.0}}, {"id": "act_d03_02", "day": 3, "intra_day_order": 2, "agent_id": "emp_006", "action_type": "REQUEST_EXCEPTION", "target": {"type": "manager", "value": ""}, "content": "I need to discuss an exception for the hybrid policy \u2014 I relocated to Portland after going remote, and my child's immunocompromised status makes both the commute disruption and open office environment a serious health risk. Can we talk through options?", "intensity": 0.75, "is_visible_to": [], "sentiment_impact": {"actor_delta": -0.008, "observer_delta": 0.0}}, {"id": "act_d04_00", "day": 4, "intra_day_order": 0, "agent_id": "emp_030", "action_type": "MESSAGE_MANAGER", "target": {"type": "manager", "value": ""}, "content": "Quick question \u2014 I was hired explicitly as remote from Austin because of my SE travel load. Does the guaranteed exception process cover roles that were remote from day one, or am I looking at relocation?", "intensity": 0.72, "is_visible_to": ["emp_024"], "sentiment_impact": {"actor_delta": -0.013, "observer_delta": 0.0}}, {"id": "act_d04_01", "day": 4, "intra_day_order": 1, "agent_id": "emp_040", "action_type": "ADVOCATE", "target": {"type": "channel", "value": "#leadership"}, "content": "The two-day hybrid model makes sense from both a fiscal and culture standpoint \u2014 we're leveraging our SF lease commitment while keeping flexibility for talent retention. Happy to walk through the real estate math with anyone who wants to see the numbers.", "intensity": 0.72, "is_visible_to": ["emp_039", "emp_041", "emp_042", "emp_043", "emp_044", "emp_045"], "sentiment_impact": {"actor_delta": 0.025, "observer_delta": 0.01}}, {"id": "act_d05_00", "day": 5, "intra_day_order": 0, "agent_id": "emp_002", "action_type": "REQUEST_EXCEPTION", "target": {"type": "manager", "value": ""}, "content": "Following up on my message from day 0 \u2014 I want to formally request a full-remote exception given the Sacramento situation. Happy to come in for critical team events or offsites, but a regular commute schedule isn't sustainable at 4 hours round-trip.", "intensity": 0.72, "is_visible_to": [], "sentiment_impact": {"actor_delta": -0.008, "observer_delta": 0.0}}, {"id": "act_d05_01", "day": 5, "intra_day_order": 1, "agent_id": "emp_031", "action_type": "REQUEST_EXCEPTION", "target": {"type": "manager", "value": ""}, "content": "Following up on our conversation \u2014 I need formal confirmation that remote roles recruited as remote-first are exempt. Relocating or flying 10+ hours weekly with three kids isn't viable, and I took a pay cut specifically for this flexibility.", "intensity": 0.75, "is_visible_to": [], "sentiment_impact": {"actor_delta": -0.008, "observer_delta": 0.0}}, {"id": "act_d06_00", "day": 6, "intra_day_order": 0, "agent_id": "emp_048", "action_type": "VENT_TO_PEER", "target": {"type": "agent", "value": ""}, "content": "Honestly, the commute thing is going to be a problem. Frustrated.", "intensity": 0.225, "is_visible_to": ["emp_011"], "sentiment_impact": {"actor_del